{
  "cell_id": "MPO_MEMORY_ENGINE_CONTEXT_UPGRADE_v1",
  "domain": "atticus-mpo",
  "project": "atticus-mpo",
  "title": "ATTICUS_MPO context-carrying memory-engine upgrade",
  "content": "ATTICUS_MPO should upgrade StoredMemoryCell from a thin finding-only structure into a compact context-bearing cell. The upgraded cell should preserve a finding plus minimal reusable context such as context_summary, context_scope, context_tags, baseline snapshot, lineage, and a context fingerprint. Retrieval and injection should rank cells by relevance and scope instead of only recency.",
  "context_summary": "Locked design direction for the next MPO memory-engine sprint. Focus is on context-bearing memory cells, bounded retrieval, safer rehydration, and backward-compatible persistence evolution.",
  "context_scope": "project",
  "context_tags": [
    "atticus-mpo",
    "memory-engine",
    "context-carrying-cells",
    "rehydration",
    "sqlite-migration"
  ],
  "source_repo": "drop0ne/atticus-mpo",
  "source_ref": "release-candidate",
  "source_branch": "release-candidate",
  "baseline_app_version": "v5.0.1",
  "baseline_framework_version": "ATTICUS v6.4.1-HCII",
  "parent_cell_id": "MPO_BASELINE_STATE_v1",
  "created_at": "2026-04-15",
  "updated_at": null,
  "provenance": {
    "origin": "cross_model_planning",
    "implementation_surfaces": [
      "core/types.py",
      "services/context_injection.py",
      "persistence/sqlite_store.py",
      "persistence/migrations.py"
    ]
  },
  "context_fingerprint": "mpo-memory-engine-context-upgrade-v1",
  "receipt_hash": null
}
