{
  "cell_id": "ATTICUS_FRAMEWORK_PROJECT_BASELINE_v1",
  "domain": "atticus",
  "project": "atticus-framework",
  "title": "ATTICUS framework project-local baseline",
  "content": "ATTICUS framework project-local state is anchored to the global ATTICUS supercell main branch as the umbrella operating context. AMAS acts as the governance anchor in v2.0-draft form, while ATTICUS_MPO release-candidate carries the active implementation baseline with PR #99 and PR #100 merged into the current memory-engine working baseline.",
  "context_summary": "Durable ATTICUS-framework project-local baseline cell created through the checklist + starter manifest workflow.",
  "context_scope": "project",
  "context_tags": [
    "atticus",
    "framework",
    "project-local",
    "baseline",
    "umbrella-context"
  ],
  "source_repo": "drop0ne/drop0ne-atticus-supercell",
  "source_ref": "main",
  "source_branch": "main",
  "baseline_app_version": "v5.0.1",
  "baseline_framework_version": "ATTICUS umbrella context",
  "parent_cell_id": "ATTICUS_CURRENT_WORKING_BASELINE_v1",
  "created_at": "2026-04-17",
  "updated_at": null,
  "provenance": {
    "origin": "project_local_instantiation",
    "source_repos": [
      "drop0ne/amas-spec",
      "drop0ne/atticus-mpo",
      "drop0ne/drop0ne-atticus-supercell"
    ]
  },
  "context_fingerprint": "atticus-framework-project-baseline-v1",
  "receipt_hash": null
}
