{
  "cell_id": "MPO_PACKET_CHAIN_PROGRESS_POST_PR100_v1",
  "domain": "atticus-mpo",
  "project": "atticus-mpo",
  "title": "ATTICUS_MPO packet-chain progress state after PR #100",
  "content": "The post-recovery implementation program remains governed by ORCH-20260411-010. ROADMAP.md still records Packet 011 and 012 as complete, Packet 013 as in progress, and Packets 014, 015, and 016 as queued. PR #99 and PR #100 improve the MPO memory-engine baseline on release-candidate, but they do not replace the governing packet chain; they land as compatible implementation progress on top of that program.",
  "context_summary": "Durable progress cell showing that the MPO packet-governance chain still governs after PR #100, while the memory-engine baseline has advanced through merged implementation work.",
  "context_scope": "project",
  "context_tags": [
    "atticus-mpo",
    "packet-chain",
    "progress",
    "pr100",
    "governance"
  ],
  "source_repo": "drop0ne/atticus-mpo",
  "source_ref": "release-candidate",
  "source_branch": "release-candidate",
  "baseline_app_version": "v5.0.1",
  "baseline_framework_version": "ATTICUS umbrella context",
  "parent_cell_id": "MPO_GOVERNING_PACKET_CHAIN_v1",
  "created_at": "2026-04-17",
  "updated_at": null,
  "provenance": {
    "origin": "cross_repo_normalization",
    "source_docs": [
      "ROADMAP.md",
      "WORK_LOG.md"
    ],
    "source_prs": [99, 100]
  },
  "context_fingerprint": "mpo-packet-chain-progress-post-pr100-v1",
  "receipt_hash": null
}
