{
  "cell_id": "SUPERCELL_OPS_PROJECT_BASELINE_v1",
  "domain": "atticus",
  "project": "supercell-ops",
  "title": "Supercell operations project-local baseline",
  "content": "The supercell operations project-local surface is anchored to the main branch of drop0ne/drop0ne-atticus-supercell. The current operating baseline includes a complete template pack with reusable files, a checklist plus starter-manifest workflow, and a one-file instantiation packet. Project-local instantiations now exist for AMAS, ATTICUS_MPO, and ATTICUS framework, and supercell_ops serves as the end-to-end validation case for the one-file packet workflow.",
  "context_summary": "Durable baseline cell for supercell operations, preserving the current supercell architecture and project-instantiation workflow state.",
  "context_scope": "project",
  "context_tags": [
    "supercell",
    "ops",
    "project-local",
    "instantiation-workflow",
    "template-pack"
  ],
  "source_repo": "drop0ne/drop0ne-atticus-supercell",
  "source_ref": "main",
  "source_branch": "main",
  "baseline_app_version": null,
  "baseline_framework_version": "ATTICUS umbrella context",
  "parent_cell_id": "ATTICUS_CURRENT_WORKING_BASELINE_v1",
  "created_at": "2026-04-17",
  "updated_at": null,
  "provenance": {
    "origin": "one_file_packet_instantiation",
    "source_artifact": "PROJECT_INSTANTIATION_PACKET_v1.md"
  },
  "context_fingerprint": "supercell-ops-project-baseline-v1",
  "receipt_hash": null
}
