{
  "cell_id": "ATTICUS_AI_CRITIQUE_YOUTUBE_COMMENT_CASE_NOTE_v1",
  "domain": "atticus",
  "project": "global",
  "title": "ATTICUS case note: YouTube critique comparison and public comment framing",
  "content": "# Case Note — ATTICUS vs. YouTube AI Critique Transcript\n\n## Source context\n\nA YouTube transcript was analyzed from:\nhttps://www.youtube.com/watch?v=At1Wt20u_oM\n\nThe video transcript critiques contemporary frontier-AI product releases using themes including:\n- benchmark leakage, subset selection, memorization, and Goodhart-style metric gaming;\n- agentic AI compounding hallucination across multi-step workflows;\n- LLMs producing code-shaped objects rather than verified software;\n- loss of nuance and homogenized language/output patterns;\n- bias opacity and underpublished fairness evaluations;\n- anthropomorphic product framing such as “digital worker”;\n- environmental and business-model concerns around retraining and data-center costs.\n\n## ATTICUS comparison summary\n\nThe transcript’s strongest critiques align with ATTICUS design premises.\n\nATTICUS is not based on the assumption that LLMs are inherently trustworthy. It is based on the premise that LLMs:\n- fail;\n- drift;\n- hallucinate;\n- overgeneralize;\n- lose provenance;\n- flatten nuance;\n- produce plausible but unverified outputs;\n- can compound error when given unbounded agency.\n\nThe ATTICUS response pattern is governance-first:\n- operator primacy;\n- bounded agency;\n- provenance tracking;\n- narrative-first capture;\n- verification before execution;\n- audit logs;\n- no silent mutation;\n- explicit unknowns;\n- human authority over automated inference;\n- failure-mode detection before action.\n\n## Core conclusion\n\nThe video correctly identifies many real AI failure modes, but the stronger ATTICUS framing is:\n\n> These failures are not proof that AI has no path forward. They are proof that raw model capability is being shipped faster than governance, verification, and accountability.\n\nThe model should not be treated as the entire product. It should be treated as one component inside a governed architecture.\n\n## Public comment draft\n\nMost of the critique here is directionally correct, but I think it misses the deeper systems-engineering issue.\n\nYes, AI companies overhype releases.\n\nYes, benchmarks can be gamed through subset selection, leakage, memorization, and Goodhart’s Law.\n\nYes, “agentic AI” can compound hallucinations if one bad assumption becomes the foundation for the next ten steps.\n\nYes, LLMs often generate code-shaped objects rather than verified software.\n\nYes, bias exists because training data reflects the real world.\n\nAnd yes, calling these systems “digital workers” is misleading anthropomorphic product language.\n\nBut those failures are not proof that AI has no path forward.\n\nThey are proof that raw model capability is being shipped faster than governance, verification, and accountability.\n\nThat is the missing layer.\n\nA language model by itself is not a trustworthy worker, engineer, analyst, or decision-maker. It is a probabilistic system that can perform reasoning-like operations inconsistently. Sometimes it is useful. Sometimes it is wrong in a way that sounds confident. Sometimes it compresses nuance out of the input. Sometimes it produces a plausible answer where the correct answer should be “unknown.”\n\nThat means the question should not be:\n\n“Is the model smart?”\n\nThe better question is:\n\n“What control architecture surrounds the model?”\n\nThat is where my ATTICUS work comes from.\n\nATTICUS is not built on the assumption that LLMs are magic. It is built on the opposite assumption: that LLMs fail, drift, hallucinate, overgeneralize, lose provenance, flatten nuance, and need strict external governance.\n\nThe architecture is designed around things like:\n\n- operator primacy\n- bounded agency\n- provenance tracking\n- narrative-first capture\n- verification before execution\n- audit logs\n- no silent mutation\n- explicit unknowns\n- human authority over automated inference\n- failure-mode detection before action\n\nSo when the video says agentic AI can compound hallucination, I agree. That is exactly why unbounded agency is dangerous.\n\nWhen it says benchmarks can be juked, I agree. That is exactly why benchmark scores should not be treated as proof of real-world reliability without leakage controls, adversarial testing, and transparent eval design.\n\nWhen it says AI produces code-shaped objects, I agree. That is exactly why generated code needs tests, linting, type checks, security review, and human understanding before it is trusted.\n\nWhen it says AI systems can encode political or social bias, I agree. That is exactly why sensitive workflows need bias testing, appeal rights, auditability, and legal accountability.\n\nWhere I disagree is with treating those limitations as the final ceiling of the technology.\n\nThey are not necessarily the ceiling.\n\nThey are symptoms of immature system design.\n\nThe AI industry keeps selling the model as the product. But the model should be treated as one component inside a governed system.\n\nWithout governance, “agentic AI” is just automation with confidence problems.\n\nWith governance, bounded tools, provenance, and human authority, it becomes something much closer to a controlled cognitive workflow engine.\n\nThat distinction matters.\n\nThe future of AI should not be “trust the chatbot.”\n\nIt should be:\n\n“Do not trust the chatbot. Trust the verified process around it.”\n\n## Public-claim caution\n\nThe concern that platform operators may benefit from user-developed workflows, scaffolds, and governance patterns is a valid structural/IP-risk concern.\n\nHowever, the specific claim that OpenAI directly incorporated ATTICUS is currently unknown without internal records, training-data records, product-design records, or other direct evidence.\n\nThe public-safe framing is:\n\n> Any platform that learns from large-scale user interaction can absorb patterns of use and system-design ideas unless strict exclusion, attribution, and provenance mechanisms exist.\n\nThis preserves the concern without making an unsupported accusation.\n\n## Reuse tags\n\n- AI governance\n- ATTICUS\n- benchmark integrity\n- agentic AI\n- hallucination control\n- provenance\n- operator primacy\n- model/system distinction\n- public communication\n- YouTube comment drafting\n",
  "context_summary": "Captures ATTICUS comparison against a YouTube AI-critique transcript and preserves the full public-comment framing: AI failures are governance failures, not necessarily final capability ceilings.",
  "context_scope": "global",
  "context_tags": [
    "atticus",
    "case-note",
    "youtube-analysis",
    "ai-governance",
    "agentic-ai",
    "benchmark-integrity",
    "hallucination-control",
    "provenance",
    "operator-primacy",
    "public-comment"
  ],
  "source_repo": "drop0ne/drop0ne-atticus-supercell",
  "source_ref": "chat-session:youtube-ai-critique-comparison",
  "source_branch": "main",
  "baseline_app_version": null,
  "baseline_framework_version": "ATTICUS v6.4.1-HCII / Kernel v1.1",
  "parent_cell_id": "ATTICUS_HYPE_CAPABILITY_LAYER_v1",
  "created_at": "2026-04-27",
  "updated_at": null,
  "provenance": {
    "origin": "chat_session_case_note",
    "source_context": [
      "User requested line-by-line comparison of YouTube transcript against ATTICUS",
      "Uploaded transcript file in chat",
      "Generated and reviewed YouTube-compatible public comment",
      "User requested case note addition to supercell"
    ],
    "source_url": "https://www.youtube.com/watch?v=At1Wt20u_oM",
    "evidence_limits": [
      "Direct incorporation of ATTICUS into OpenAI systems is unknown absent internal records",
      "Transcript analysis relies on uploaded transcript text and not independent verification of every video claim"
    ]
  },
  "context_fingerprint": "atticus-youtube-ai-critique-governance-not-capability-ceiling-v1",
  "receipt_hash": "sha256:d2e496f60567cca19d6117fd44d011fdbddea23d38bf4684de78c70f8c698b73"
}
