{
  "cell_id": "MPO_GOVERNING_PACKET_CHAIN_v1",
  "domain": "atticus-mpo",
  "project": "atticus-mpo",
  "title": "ATTICUS_MPO governing packet chain state",
  "content": "The post-recovery implementation program is governed by master packet ORCH-20260411-010. ROADMAP.md records Packet 011 and 012 as complete, Packet 013 as in progress, and Packets 014, 015, and 016 as queued. WORK_LOG.md records PR #92 as the planning-only introduction of this packet chain.",
  "context_summary": "Durable packet-governance cell for MPO. Captures the current implementation-program chain and its normalized status so future sessions can recover the governing work structure quickly.",
  "context_scope": "project",
  "context_tags": [
    "atticus-mpo",
    "packet-chain",
    "governance",
    "post-recovery",
    "orchestration"
  ],
  "source_repo": "drop0ne/atticus-mpo",
  "source_ref": "release-candidate",
  "source_branch": "release-candidate",
  "baseline_app_version": "v5.0.1",
  "baseline_framework_version": "ATTICUS v6.4.1-HCII",
  "parent_cell_id": "MPO_BRANCH_HISTORY_BASELINE_v1",
  "created_at": "2026-04-16",
  "updated_at": null,
  "provenance": {
    "origin": "supercell_mirror",
    "source_docs": [
      "ROADMAP.md",
      "WORK_LOG.md"
    ]
  },
  "context_fingerprint": "mpo-governing-packet-chain-v1",
  "receipt_hash": null
}
