{
  "cell_id": "MPO_RETRIEVAL_RANKING_FOLLOWUP_v1",
  "domain": "atticus-mpo",
  "project": "atticus-mpo",
  "title": "ATTICUS_MPO retrieval-quality follow-up after context-cell merge",
  "content": "After PR #99, the next memory-engine follow-up is retrieval quality rather than basic persistence. The current merged ranking now uses scope and tag richness with recency fallback, but it does not yet consume explicit query, session-task, or packet-level relevance hints. The next sprint should add stronger query-aware or task-aware ranking while preserving bounded injection and backward compatibility.",
  "context_summary": "Durable follow-up cell for the next MPO memory-engine sprint. Captures the remaining gap after the merged context-cell upgrade: retrieval quality and stronger relevance ranking.",
  "context_scope": "project",
  "context_tags": [
    "atticus-mpo",
    "retrieval-quality",
    "ranking",
    "query-aware",
    "memory-engine"
  ],
  "source_repo": "drop0ne/atticus-mpo",
  "source_ref": "release-candidate",
  "source_branch": "release-candidate",
  "baseline_app_version": "v5.0.1",
  "baseline_framework_version": "ATTICUS v6.4.1-HCII",
  "parent_cell_id": "MPO_MEMORY_ENGINE_CONTEXT_UPGRADE_MERGED_v1",
  "created_at": "2026-04-16",
  "updated_at": null,
  "provenance": {
    "origin": "supercell_followup_planning",
    "source_docs": [
      "ROADMAP.md"
    ],
    "source_pr": 99
  },
  "context_fingerprint": "mpo-retrieval-ranking-followup-v1",
  "receipt_hash": null
}
