{
  "cell_id": "AMAS_PROJECT_BASELINE_v1",
  "domain": "amas",
  "project": "amas",
  "title": "AMAS project-local baseline",
  "content": "AMAS project-local state is currently anchored to the main branch of drop0ne/amas-spec and represented as v2.0-draft. The doctrine explicitly separates governance core, runtime binding, and conformance profiles, while preserving the four-tier authority model of CANONICAL, OPERATOR, SESSION, and INFERRED.",
  "context_summary": "Durable AMAS project-local baseline cell used to test the first non-MPO project-local supercell instantiation.",
  "context_scope": "project",
  "context_tags": [
    "amas",
    "project-local",
    "baseline",
    "v2.0-draft",
    "doctrine"
  ],
  "source_repo": "drop0ne/amas-spec",
  "source_ref": "main",
  "source_branch": "main",
  "baseline_app_version": null,
  "baseline_framework_version": "ATTICUS umbrella context",
  "parent_cell_id": "AMAS_GOVERNANCE_BASELINE_v1",
  "created_at": "2026-04-17",
  "updated_at": null,
  "provenance": {
    "origin": "project_local_instantiation",
    "source_docs": [
      "README.md",
      "SPEC.md",
      "RUNTIME_BINDING.md",
      "CONFORMANCE_PROFILES.md"
    ]
  },
  "context_fingerprint": "amas-project-baseline-v1",
  "receipt_hash": null
}
